{"title":"Fictional Northwind PRD","problem":"Fictional reports describe slow environment setup; no duration improvement has been measured.","proposedSuccessCriterion":"Unresolved proposed pilot criteria; no outcome claimed.","risks":["Tenant isolation review pending","Rollback and manual fallback plan unresolved"],"openQuestions":["What criteria should an opt-in pilot use?","Who will record the pilot decision?"],"fictional":true}
